title|publishDate|ISBN|[authors]|recipe
The Art of French Cooking, Vol. 1|1961||Julia Child,Simone Beck,Louisette Bertholie|Beef Bourguignon
The Art of French Cooking, Vol. 1|1961||Julia Child,Simone Beck, Louisette Bertholie|French Onion Soup
Simca's Cuisine: 100 Classic French Recipes for Every Occasion|1972|0-394-40152-2|Simone Beck, Patricia Simon|something
The French Chef Cookbook|1968|0-394-40135-2|Julia Child|something else
The Art of Simple Food: Notes, Lessons, and Recipes from a Delicious Revolution|2007|0-307-33679-4|Alice Waters, Patricia Curtan,Kelsie Kerr,Fritz Streiff|something
